<?xml version="1.0" encoding="UTF-8"?>
<root xmlns:xsi="http://www.w3.org/2001/XMLSchema-instance"
 xsi:noNamespaceSchemaLocation="../XML_Schema/OrtsRprt-wrkg_1-deu.xsd">
    <polBezirke>
        <polBezirk>
            <placeName lang="deu" key="2762315">Völkermarkt</placeName>
            <placeName lang="slv" key="2762315">Velikovec</placeName>
            <gerichtsBezirke>
                <gerichtsBezirk n="1">
                    <placeName lang="deu" key="2781703">Bleiburg</placeName>
                    <placeName lang="slv" key="2781703">Pliberk</placeName>
                    <gemeinden>
                        <gemeinde n="1" ko="">
                            <placeName lang="deu" key="2781703">Bleiburg</placeName>
                            <placeName lang="slv" key="2781703">Pliberk</placeName>
                        </gemeinde>
                        <gemeinde n="2">
                            <placeName lang="deu" key="2779703">Feistritz</placeName>
                            <placeName lang="slv" key="2779703">Bistrica</placeName>
                            <orte>
                                <ort n="1">
                                    <placeName lang="deu" key="3214041">Dolintschitschach</placeName>
                                    <placeName lang="slv" key="3214041">Dolinčiče</placeName>
                                </ort>
                                <ort n="2" ko="2, 3, 4 t., 5, 8, 9">
                                    <placeName lang="deu" key="2779703">Feistritz</placeName>
                                    <placeName lang="slv" key="2779703">Bistrica</placeName>
                                </ort>
                                <ort n="3">
                                    <placeName lang="deu" key="2778343">Gonowetz</placeName>
                                    <placeName lang="slv" key="2778343">Gonovece</placeName>
                                </ort>
                                <ort n="4">
                                    <placeName lang="deu" key="3214042">Hinterlibitsch</placeName>
                                    <placeName lang="slv" key="3214042">Podlibič</placeName>
                                </ort>
                                <ort n="5">
                                    <placeName lang="deu" key="2775879">Hof</placeName>
                                    <placeName lang="slv" key="2775879">Dvor</placeName>
                                </ort>
                                <ort n="6">
                                    <placeName lang="deu" key="2772572">Lettenstätten</placeName>
                                    <placeName lang="slv" key="2772572">Letinje</placeName>
                                </ort>
                                <ort n="7" ko="1, 7, 14">
                                    <placeName lang="deu" key="2769139">Penk</placeName>
                                    <placeName lang="slv" key="2769139">Ponikva</placeName>
                                </ort>
                                <ort n="8">
                                    <placeName lang="deu" key="2768778">Pirkdorf</placeName>
                                    <placeName lang="slv" key="2768778">Brežka Ves</placeName>
                                </ort>
                                <ort n="9">
                                    <placeName lang="deu" key="3214048">Ruttach</placeName>
                                    <placeName lang="slv" key="3214048">Rute</placeName>
                                </ort>
                                <ort n="10" ko="4 t., 6, 10, 12">
                                    <placeName lang="deu" key="2766504">Sankt Michael</placeName>
                                    <placeName lang="slv" key="2766504">Šmihel</placeName>
                                </ort>
                                <ort n="11" ko="">
                                    <placeName lang="deu" key="2763419">Traundorf</placeName>
                                    <placeName lang="slv" key="2763419">Strpna Ves</placeName>
                                </ort>
                                <ort n="12">
                                    <placeName lang="deu" key="2763296">Tscherberg</placeName>
                                    <placeName lang="slv" key="2763296">Čergoviče</placeName>
                                </ort>
                                <ort n="13" ko="" koopomba="Unterort 1, Podkraj 1 ko.">
                                    <placeName lang="deu" key="2762738">Unterort</placeName>
                                    <placeName lang="slv" key="2762738">Podkraj</placeName>
                                </ort>
                                <ort n="14"><!-- brez označbe, pod naseljema Penk in Dolinčiče -->
                                    <placeName lang="deu">Winkel</placeName>
                                    <placeName lang="slv">Kot</placeName>
                                </ort>
                            </orte>
                        </gemeinde>
                        <gemeinde n="3">
                            <placeName lang="deu" key="3189025">Fettengupf</placeName>
                            <placeName lang="slv" key="3189025">Tolski Vrh</placeName>
                            <orte>
                                <ort n="1">
                                    <placeName lang="deu" key="3201940">Dobriach</placeName>
                                    <placeName lang="slv" key="3201940">Dobrije</placeName>
                                    <teile>
                                        <teil>
                                            <placeName lang="deu" key="3201940">Dobriach</placeName>
                                            <placeName lang="slv" key="3201940">Dobrije</placeName>
                                            <vrsta>selo</vrsta>
                                            <hise>4</hise>
                                            <prebivalci>34</prebivalci>
                                            <vrsta>raztresene hiše</vrsta>
                                            <hise>10</hise>
                                            <prebivalci>39</prebivalci>
                                        </teil>
                                    </teile>
                                </ort>
                                <ort n="2" ko="2, 7, 8">
                                    <placeName lang="slv" key="8987423">Dobrova</placeName>
                                    <teile>
                                        <teil>
                                            <placeName lang="slv" key="8987423">Dobrova</placeName>
                                            <vrsta>selo</vrsta>
                                            <hise>8</hise>
                                            <prebivalci>54</prebivalci>
                                            <vrsta>raztresene hiše</vrsta>
                                            <hise>11</hise>
                                            <prebivalci>50</prebivalci>
                                        </teil>
                                    </teile>
                                </ort>
                                <ort n="3" ko="">
                                    <placeName lang="deu" key="3189025">Fettengupf</placeName>
                                    <placeName lang="slv" key="3189025">Tolsti Vrh</placeName>
                                </ort>
                                <ort n="4" ko="">
                                    <placeName lang="deu">Gamsenegg</placeName>
                                    <placeName lang="slv">Javornik</placeName>
                                </ort>
                                <ort n="5" ko="">
                                    <placeName lang="deu" key="3186620">Schöllenberg</placeName>
                                    <placeName lang="slv" key="3186620">Šelenberg</placeName>
                                    <teile>
                                        <teil>
                                            <placeName lang="deu" key="3186620">Schöllenberg</placeName>
                                            <placeName lang="slv" key="3186620">Šelenberg</placeName>
                                            <vrsta>selo</vrsta>
                                            <hise>3</hise>
                                            <prebivalci>29</prebivalci>
                                            <vrsta>raztresene hiše</vrsta>
                                            <hise>26</hise>
                                            <prebivalci>176</prebivalci>
                                        </teil>
                                    </teile>
                                </ort>
                                <ort n="6" ko="1, 6">
                                    <placeName lang="deu" key="8986924">Selloutz</placeName>
                                    <placeName lang="slv" key="8986924">Selovec</placeName>
                                </ort>
                                <ort n="7">
                                    <placeName lang="deu">Ueberfuhr</placeName>
                                    <placeName lang="slv">Na Brodu</placeName>
                                </ort>
                                <ort n="8">
                                    <placeName lang="deu" key="8987434">Unterklanz</placeName>
                                    <placeName lang="slv" key="8987434">Pod Klancem</placeName>
                                </ort>
                            </orte>
                        </gemeinde>
                        <gemeinde n="4" ko=""><!-- Ravne na Koroškem -->
                            <placeName lang="deu" key="3191839">Gutenstein</placeName>
                            <placeName lang="slv" key="3191839">Guštanj</placeName>